<?xml version="1.0" encoding="UTF-8"?>
<ListaEmpleados xmlns:xsi="http://www.w3.org/2001/XMLSchema-instance" xsi:noNamespaceSchemaLocation="Nombres.xsd">
	<NombreEmpleado>
		<PrimerNombre>Rafael</PrimerNombre>
		<SegundoNombre>Jose</SegundoNombre>
		<Apellido>Carvajal</Apellido>
	</NombreEmpleado>
	<NombreEmpleado>
		<SegundoNombre>Saphina</SegundoNombre>
		<Apellido>Ramirez</Apellido>
		<PrimerNombre>Mary</PrimerNombre>
	</NombreEmpleado>
	<NombreEmpleado>
		<PrimerNombre>Robert</PrimerNombre>
		<Apellido>Contreras</Apellido>
	</NombreEmpleado>
</ListaEmpleados>
